id,description
176,"Cap 4 bottoms - When your world consists of granite frozen into place, our Capilene 4 Bottoms keep you dry and warm with a cozy interior grid that traps heat, wicks perspiration, and breathes. A smooth, stretchy exterior glides easily beneath layers so you can concentrate on front-pointing or landing your tele. A brushed, scalloped-edge elastic waistband adds all-day softness. Made from 5.3-oz Polartec Power Dry 93% polyester (50% recycled)/7% spandex, with Gladiodor natural odor control for the garment. Recyclable through the Common Threads Recycling Program.<br><br><b>Details:</b><ul> <li>""Our warmest baselayer fabric, Capilene 4 offers stretch, great breathability and compressibility""</li> <li>""Interior grid wicks moisture, trims bulk and provides warmth""</li> <li>Smooth jersey face slides easily beneath layers</li> <li>""4-panel construction, pull-on tights""</li> <li>Scalloped-edge elastic waistband is brushed for next-to-skin softness</li></ul><br><br><b>Fabric: </b>""5.3-oz Polartec Power Dry 93% polyester (50% recycled)/7% spandex, with Gladiodor natural odor control for the garment. Recyclable through the Common Threads Recycling Program""<br><br><b>Weight: </b>(170 g 5.9 oz)<br><br>Made in Costa Rica."
177,"Dala horse t-shirt - Originally fashioned from wood scraps by Swedish carvers on long winter nights, Dala horses exude a playful spirit and embody ingenuity and resourcefulness. The Dala Horse T-Shirt's original artwork by Mary Helt is printed on 100% organic cotton using PVC- and phthalate-free inks. The slightly-shaped tee has an athletic, classic boy fit and features a traditional crew neck. Taped shoulder seams are soft next-to-skin. Recyclable through the Common Threads Recycling Program.<br><br><b>Details:</b><ul> <li>Ringspun yarns for a softer hand</li> <li>Taped shoulder seams</li> <li>Screen-print inks are PVC- and phthalate-free</li></ul><br><br><b>Fabric: </b>4.4-oz 100% organic cotton. Recyclable through the Common Threads Recycling Program<br><br><b>Weight: </b>(112 g 3.9 oz)<br><br>Made in USA."
178,"Ditch the car-ride t-shirt - The fun is in the getting there - enjoy the ride with the Ditch the Car-Ride T-Shirt. Artist Nikki McClure's paper cutout artwork floats across the shirt's 100% organic cotton fabric. The slightly-shaped tee has an athletic, classic boy fit and features a traditional crew neck. PVC- and phthalate-free inks are easier on the environment. Taped shoulder seams won't chafe under a pack. Recyclable through the Common Threads Recycling Program.<br><br><b>Details:</b><ul> <li>Ringspun yarns for a softer hand</li> <li>Taped shoulder seams</li> <li>Screen-print inks are PVC- and phthalate-free</li></ul><br><br><b>Fabric: </b>4.4-oz 100% organic cotton. Recyclable through the Common Threads Recycling Program<br><br><b>Weight: </b>(112 g 3.9 oz)<br><br>Made in USA."
179,"Down sweater - There's much to see 14,000 feet up at the Chasm View bivy: a vertigo-inducing panorama of the Diamond and alpenglow over the Rockies. There's also chilly air in any season, and that's where our Down Sweater comes in. It delivers minimal weight, superb compressibility and high-loft warmth. The polyester shell does more than look sharp: It's tear-resistant, windproof, has a DWR (durable water repellent) finish, and is made from 100% recycled polyester. Details include top-quality European goose down, a quilted-through construction, two exterior zippered pockets, a stretch-mesh interior chest pocket that doubles as a zippered stuff sack and a carabiner clip-in loop. A drawcord hem helps trap heat.<br><br><b>Details:</b><ul> <li>""Shell fabric is superlight, windproof and water-resistant with high tear-strength""</li> <li>Quilted construction stabilizes premium 800-fill-power goose down</li> <li>""Pockets: zippered handwarmers and one interior, zippered stretch-mesh that doubles as a stuff sack; with carabiner clip-in loop""</li> <li>Nylon-bound elastic cuffs</li> <li>Drawcord hem</li></ul><br><br><b>Fabric: </b>Shell and lining: 1.4-oz 22-denier 100% all-recycled polyester ripstop with a Deluge DWR (durable water repellent) finish. Insulation: 800-fill-power premium European goose down<br><br><b>Weight: </b>320 g (11.3 oz)<br><br>Made in China."
180,"El cap jkt - Stuff the El Cap Jacket into your pack on your next Winds walkabout - its lightweight, layerable nature makes it a classic. The double-faced and brushed polyester fleece (78% recycled) wicks moisture and dries quickly. The feminine contouring includes on-seam handwarmer pockets. Recyclable through the Common Threads Recycling Program.<br><br><b>Details:</b><ul> <li>""Made of lightweight, packable and quick-to-dry recycled polyester""</li> <li>""Polyester satin taffeta trim at front zipper, pockets and shoulder seams adds feminine detail""</li> <li>Front on-seam handwarmer pockets</li> <li>""Side panels and seams provide a flattering, feminine fit""</li> <li>Drop tail</li> <li>Spandex binding clean-finishes inside neck seam</li></ul><br><br><b>Fabric: </b>5.7-oz 100% polyester (78% recycled) brushed double-faced fleece. Recyclable through the Common Threads Recycling Program<br><br><b>Weight: </b>286 g (10.1 oz)<br><br>Made in Colombia."
181,"Elsa top - When shade-seeking at Nine Palms starts to resemble a full-time job, head for plaza tacos and cold ones in the airy Elsa Top. The incredibly lightweight, 100% organic cotton blouse can be worn on or off the shoulder depending on the fiesta factor; the gathers around the neckline and sleeves add a feminine touch. Hip length with an elastic cinch at the hem. Recyclable through the Common Threads Recycling Program.<br><br><b>Details:</b><ul> <li>Light and airy organic cotton lawn</li> <li>Blousy top to be worn on or off the shoulder</li> <li>Gathers around neckline and sleeves for feminine appeal</li> <li>Hip length with elastic cinch at hem</li></ul><br><br><b>Fabric: </b>2.2-oz 100% organic cotton. Recyclable through the Common Threads Recycling Program<br><br><b>Weight: </b>(112 g 3.9 oz)<br><br>Made in Thailand."
182,"Elsa tunic - The Elsa Tunic flourishes in heat-prone latitudes where its cool nature is an asset. Made from our lightest organic cotton weave, the loose-fitting shirt promotes airflow in sticky conditions. Highly versatile, the mid-thigh top can be worn with leggings, jeans, shorts, or over swimwear. A scoop neck with yoke dart and shirring detail lend feminine style; pockets on side seams stash loose items. Recyclable through the Common Threads Recycling Program.<br><br><b>Details:</b><ul> <li>Light and airy organic cotton lawn</li> <li>Scoop neck with yoke dart and shirring detail</li> <li>Pockets on side seams</li> <li>""Mid-thigh tunic to can be layered with leggings, jeans or shorts""</li></ul><br><br><b>Fabric: </b>2.2-oz 100% organic cotton. Recyclable through the Common Threads Recycling Program<br><br><b>Weight: </b>(98 g 3.4 oz)<br><br>Made in Thailand."
183,"Gravitee tank - The Gravitee's racerback and full shelf bra offer all the support and unrestricted movement of a traditional tank but in a bold and relaxed silhouette. The banded hem sits snugly on the hips, providing comfort under a harness and modesty during inverted poses. The Gravitee's light, breathable 54% organic cotton/41% Tencel/5% spandex blend and non-compression styling work together to keep the air circulating. Recyclable through the Common Threads Recycling Program.<br><br><b>Details:</b><ul> <li>""A blend of organic cotton and Tencel, with a touch of spandex for stretch and performance""</li> <li>A racerback tank with feminine twist at center front</li> <li>Full shelf bra for active support</li> <li>Wide hem band sits snugly on hips</li></ul><br><br><b>Fabric: </b>6.1-oz 54% organic cotton/41% Tencel/5% spandex jersey.  Recyclable through the Common Threads Recycling Program<br><br><b>Weight: </b>(213 g 7.4 oz)<br><br>Made in Thailand."
184,"Guide jkt - Sharp granite, sticky verglas, untracked lines - enjoy them all in this all-around workhorse soft shell. Extremely durable, stretchy and breathable, the 4-way-stretch polyester double weave allows for an excellent fit while resisting wind, water and snow. A chamois lining on the collar, chin guard and wind flap complements the soft, brushed interior for next-to-skin comfort. The regular-coil center-front zipper with DWR (durable water repellent) finish, three external pockets, articulated arms, a drawcord hem and self-fabric cuff tabs round out the details. Recyclable through the Common Threads Recycling Program.<br><br><b>Details:</b><ul> <li>""Burly, 4-way-stretch double-weave polyester is water- and wind-resistant and highly breathable""</li> <li>Brushed interior for next-to-skin comfort with DWR (durable water repellent finish)</li> <li>""Chamois-lined collar, chin guard, and wind flap""</li> <li>""External pockets: two handwarmers with zipper garages, one lower left arm - all pocket zippers have a DWR finish""</li> <li>Articulated arms</li> <li>""Low-profile, laminated, self-fabric cuff tabs""</li> <li>Drawcord hem</li></ul><br><br><b>Fabric: </b>7.6-oz 70-denier 92% polyester (47% recycled) double weave with 4-waystretch/8% spandex with Deluge DWR finish. Recyclable through the Common Threads Recycling Program<br><br><b>Weight: </b>578 g (20.4 oz)<br><br>Made in Vietnam."
185,"Hills t-shirt - Head for the hills wearing the simply-designed Hills T-Shirt. Artist Mary Helt's modern graphic is printed with PVC- and phthalate-free inks on a canvas of 100% organic cotton. The lightweight shirt's Anika fit features a longer torso that's form-fitting, shorter sleeves and wide, deep neckline. Ringspun fabric yarns and taped shoulder seams add softness. Recyclable through the Common Threads Recycling Program.<br><br><b>Details:</b><ul> <li>Ringspun yarns for a softer hand</li> <li>Taped shoulder seams</li> <li>Screen-print inks are PVC- and phthalate-free</li></ul><br><br><b>Fabric: </b>4.4-oz 100% organic cotton. Recyclable through the Common Threads Recycling Program<br><br><b>Weight: </b>(112 g 3.9 oz)<br><br>Made in USA."
186,"Inga shorts - Long rides continue after the session's over with the Inga Shorts. An extended 11"" inseam and pinstripe organic cotton canvas offer a graceful alternative to denim. The slim-fitting shorts have a low rise and shaped waistband, plus five-pocket jean styling and topstitching for a durable finish. With a zip fly and button closure. Recyclable through the Common Threads Recycling Program.<br><br><b>Details:</b><ul> <li>""Soft, sturdy organic cotton canvas""</li> <li>Shaped waistband with belt loops; zip fly with logo shank button closure</li> <li>Five-pocket-jean styling and topstitching</li> <li>Low rise</li> <li>""Inseam is 11""""""</li></ul><br><br><b>Fabric: </b>8.7-oz 100% organic cotton canvas. Recyclable through the Common Threads Recycling Program<br><br><b>Weight: </b>(305 g 10.6 oz)<br><br>Made in Thailand."
187,"Inter-continental capris - Inter-Continental Capris recover quickly from night flights and sudden downpours because, unlike the rest of us, they are made from a stretch-woven blend of 52% nylon/48% polyester and have a DWR (durable water repellent) finish. The capris feature a seamless waistband and a zip fly with button closure. With two front slant pockets and two zippered welted security pockets - one on the right side and one in back. Regular rise; inseam (size 8) is 24"". Recyclable through the Common Threads Recycling Program.<br><br><b>Details:</b><ul> <li>Mechanical stretch-woven fabric with DWR (durable water repellent) finish</li> <li>""1"""" waistband (with belt loops); zip fly with button closure""</li> <li>Two front pockets; zippered welted back and side pockets</li> <li>Forward-angled side seams</li> <li>Regular rise</li> <li>""Inseam is 24""""""</li></ul><br><br><b>Fabric: </b>4.5-oz 52% nylon/48% polyester with DWR finish. Recyclable through the Common Threads Recycling Program<br><br><b>Weight: </b>(253 g 8.8 oz)<br><br>Made in Vietnam."
188,"Inter-continental pants - long - You'll like the flattering drape of these lightweight pants made from a stretch-woven blend of 52% nylon/48% polyester. The fabric recovers quickly from prolonged sittings and has a DWR (durable water repellent) finish that sheds water. For extra versatility, the legs roll up to a capri length and fasten with snap closures. With two front slant pockets and one back security pocket. Regular rise; inseam (size 8) is 31"". Recyclable through the Common Threads Recycyling Program.<br><br><b>Details:</b><ul> <li>""Mechanical stretch-woven fabric with DWR (durable water repellent) finish; 1"""" waistband (with belt loops)""</li> <li>Zip fly with button closure</li> <li>Quarter-top front pockets; zippered welted back pockets</li> <li>Forward-angled side seams</li> <li>Legs fasten with self-fabric tab and snap for capri length</li> <li>Regular rise</li> <li>""Inseam is 33""""""</li></ul><br><br><b>Fabric: </b>4.5-oz 52% nylon/48% polyester with DWR finish. Recyclable through the Common Threads Recycling Program<br><br><b>Weight: </b>283 g (10 oz)<br><br>Made in Vietnam."
189,"Island hemp pants - A solid choice for evening horseshoes, the Island Hemp Pants have a linen-like drape that's confident, never clingy. Made from a blend of hemp and organic cotton (55%/45%) plain weave, the pants have a regular rise with a wide leg silhouette. Comes with a zip fly and double-button front closure; the waistband has belt loops and a drawcord for added adjustability. Roomy, drop-in front patch pockets provide storage. Back patch pockets with button closures lend style. Inseam (size 8) is 32"". Recyclable through the Common Threads Recycling Program.<br><br><b>Details:</b><ul> <li>Hemp is soft with a linen-like drape</li> <li>Zip fly with double-button closure</li> <li>Waistband with belt loops; drawcord for added adjustability</li> <li>Drop-in front patch pockets; back patch pockets with button closure</li> <li>Regular rise</li> <li>""Inseam (size 8) is 32""""""</li></ul><br><br><b>Fabric: </b>4-oz 55% hemp/45% organic cotton plain weave. Recyclable through the Common Threads Recycling Program<br><br><b>Weight: </b>(288 g 10 oz)<br><br>Made in China."
190,"Island hemp skirt - The Island Hemp Skirt brings freestyle comfort to any creekside rock-skipping session. The skirt's summer-weight hemp/organic cotton (55%/45%) fabric blend has a soft, linen-like drape. Cut on the bias, it has a zip fly with double-button closure and a shaped waistband with adjustable drawcord. Two back patch pockets with button closures hold skipping rocks. Falls below the knee with a waist-to-hem length of 30"". Recyclable through the Common Threads Recycling Program.<br><br><b>Details:</b><ul> <li>Hemp is soft with a linen-like drape</li> <li>Zip fly with double button closure</li> <li>Shaped waistband; drawcord for added adjustability</li> <li>Bias-cut for drape</li> <li>2 back patch pockets with button closure</li> <li>Falls below the knee</li> <li>""Waist-to-hem length 30""""""</li></ul><br><br><b>Fabric: </b>4-oz 55% hemp/45% organic cotton plain weave. Recyclable through the Common Threads Recycling Program<br><br><b>Weight: </b>(204 g 7.1 oz)<br><br>Made in China."
191,"Island hemp top - The breezy Island Hemp Top takes you from soaring Sierra midday temps to cool twilight without crumpling. The tank's linen-like hand and bias cut increase air flow and create a flattering drape. Made from a summer-weight blend of hemp and organic cotton (55%/45%), the hip-length top has a coconut button closure down the center-back and a front yoke seam for shaping. Recyclable through the Common Threads Program.<br><br><b>Details:</b><ul> <li>Summer-weight blend of hemp and organic cotton with a linen-like feel</li> <li>Strappy top with coconut button closure down center-back</li> <li>Flattering yoke seam for shaping</li> <li>""Delicate print, with solid contrast straps""</li> <li>Hip length</li></ul><br><br><b>Fabric: </b>4-oz 55% hemp/45% organic cotton plain weave. Recyclable through the Common Threads Recycling Program<br><br><b>Weight: </b>(118 g 4.1 oz)<br><br>Made in China."
192,"Lithia dress - Celebrate the Summer Solstice with a dress that makes the most of longer days. The summer-weight Lithia Dress is made from a blend of organic cotton (55%) and Tencel (45%) that's soft, fluttery and flowing. With a bodice that gathers at the neck, the dress has a full, built-in shelf bra for ease and comfort. An elasticized waist, separate tie belt and an A-line drape add femininity. Front and back handkerchief hemline falls below the knee. Recyclable through the Common Threads Recycling Program.<br><br><b>Details:</b><ul> <li>Soft-handed jersey knit with smooth drape</li> <li>Bodice gathers at neck front and back</li> <li>Elasticized waist with separate tie belt</li> <li>Beautiful A-line drape</li> <li>""Handkerchief hemline comes a to point, in both the front and back, below the knee""</li></ul><br><br><b>Fabric: </b>4.8-oz 55% organic cotton/45% Tencel. Recyclable through the Common Threads Recycling Program<br><br><b>Weight: </b>(401 g 13.9 oz)<br><br>Made in Thailand."
193,"Lithia pants - Pull out the Lithia Pants after you've gotten your daily wave fix - the soft-handed fabric and smooth drape gently transition you back to the ""terrestrial world."" Made from a summery, lightweight organic cotton/Tencel (55%/45%) blend, the pants have a shirred waist with a wide cinched waistband that's adjustable with side ties on the right side. The relaxed leg and low rise offer a flattering fit; inseam (size M) is 32"". Recyclable through the Common Threads Recycling Program.<br><br><b>Details:</b><ul> <li>Soft-handed jersey knit with smooth drape</li> <li>""Flattering, wide, cinched waistband; adjustable on right side with ties""</li> <li>Relaxed leg</li> <li>Low rise</li> <li>""Inseam (size M) is 32""""""</li></ul><br><br><b>Fabric: </b>4.8-oz 55% organic cotton/45% Tencel. Recyclable through the Common Threads Recycling Program<br><br><b>Weight: </b>(239 g 8.3 oz)<br><br>Made in Thailand."
194,"Lithia skirt - After packing the quiver, who has room for clothes? The versatile Lithia Skirt solves the space dilemma by functioning as both a skirt and a top. The multitasker's lightweight organic cotton (55%)/Tencel (45%) fabric is supersoft and scrunchable. As an A-line skirt, the doubled, shirred waistband cinches down with side ties on one side and falls just above the knee. As a top, the adjustable waistband becomes a bandeau-style bodice that ties behind the neck. Waist-to-hem length is 17"". Recyclable through the Common Threads Recycling Program.<br><br><b>Details:</b><ul> <li>Soft-handed jersey knit with smooth drape</li> <li>""Snug, wide, cinched waistband; adjustable on right side with ties""</li> <li>""A-line shape skirt, above the knee length""</li> <li>""17"""" length, waist to hem, when cinched""</li> <li>Skirt's doubled waistband becomes bandeau style bodice for top and ties behind the neck</li></ul><br><br><b>Fabric: </b>4.8-oz 55% organic cotton/45% Tencel. Recyclable through the Common Threads Recycling Program<br><br><b>Weight: </b>(152 g 5.3 oz)<br><br>Made in Thailand."
195,"L/s rashguard - The 30-UPF fabric of our Long-Sleeved Rashguard keeps the sun from sizzling your skin. With a slim neckline, wide underarm panels and ergonomically placed seams. Made from a durable blend of 5.8-oz 84% all-recycled polyester/16% spandex.<br><br><b>Details:</b><ul> <li>Stretchy all-recycled polyester/spandex fabric offers protection against chafing and sun</li> <li>30-UPF sun protection</li> <li>Mock neck and set-in long sleeves with seamless underarm gussets and flat-seam construction</li></ul><br><br><b>Fabric: </b>5.8-oz 84% all-recycled polyester/16% spandex<br><br><b>Weight: </b>(164 g 5.7 oz)<br><br>Made in USA."
196,"L/s runshade top - Long days and scorching rays can't stop the cool, comfortable-wearing Runshade Top. Its moisture-wicking 100% polyester jersey is now more durable, provides 30-UPF sun protection, and dries quickly. A deep center-front zip (now with an invisible zipper) vents body heat, and the revised overall design retains feminine shaping without bulk. An updated, streamlined mini-stand-up collar has less bulk and still protects your neck from the sun, and raglan sleeves with side panels keep seams clear of pack straps. The stash pocket is now centered on the lower back and closes with an invisible zip. A reflective heat-transfer logo keeps you visible. Recyclable through the Common Threads Recycling Program.<br><br><b>Details:</b><ul> <li>""Moisture-wicking, Runshade fabric throughout is super soft and provides 30-UPF sun protection""</li> <li>Minimalist collar stand offers neck protection from the sun without adding bulk</li> <li>Deep center-front invisible zipper is clean-finished for next-to-skin comfort</li> <li>Raglan sleeves and side panels keep seams out of the way of pack straps</li> <li>Center-back zippered pocket</li> <li>Reflective heat-transfer logo</li></ul><br><br><b>Fabric: </b>4.3-oz 100% polyester jersey. Recyclable through the Common Threads Recycling Program<br><br><b>Weight: </b>(170 g 5.9 oz)<br><br>Made in Vietnam."
197,"M10 jkt - Made for those who thrive on thin and technical climbs in full alpine conditions, the new M10 is a study in minimalism - and our lightest 3-layer hard shell. The soft, pliable waterproof/breathable nylon ripstop fabric yields superb durability for its weight and protects against monsoon-season precip and summit ridge gusts. Details include watertight zippers, a microfleece-lined neck and chin, an exterior zippered left-chest pocket, zippered handwarmer pockets that serve double-duty by extending into pit zips, and cuffs that adjust with hook-and-loop closures. A single pull adjusts the 3-way helmet-compatible hood (with laminated visor) - it's the little things that make life a joy when dealing with wooden fingers, a gloved hand and torrential spindrift. Slim fit for technical use over light-to-medium layers.<br><br><b>Details:</b><ul> <li>3-layer fabric with waterproof/breathable H2No barrier and Deluge DWR (durable water repellent) finish; laminated visor</li> <li>""Minimalist, single-pull 3-way-adjustable, helmet compatible hood; microfleece-lined neck and chin for comfort and enhanced protection of barrier""</li> <li>Watertight zippers for wet-weather performance</li> <li>Zippers on handwarmer pockets extend to pit zips for ventilation</li> <li>""Exterior, zippered left-chest pocket""</li> <li>Self-fabric hook-and-loop cuff closures</li> <li>Drawcord hem</li></ul><br><br><b>Fabric: </b>""3-layer, 2.2-oz 15-denier 100% nylon ripstop with a waterproof/breathable H2No barrier and a Deluge DWR finish""<br><br><b>Weight: </b>292 g (10.3 oz)<br><br>Made in Vietnam."
198,"Mandeville hoody - A going-places hoody. The Mandeville's soft, waffle knit is a supple blend of 40% organic cotton, 35% Tencel and 20% all-recycled polyester with 5% spandex for stretch. The rib-knit trimmed hood (with drawcord) opens to a full zip; the extra-wide rib-knit cuffs have thumb loops for attitude; the hem, also in a rib knit, hits at the lower hip. With handwarmer pockets. Recyclable through the Common Threads Recycling Program.<br><br><b>Details:</b><ul> <li>Supersoft organic cotton/Tencel blend waffle-knit hoody with cotton twill drawcord in hood</li> <li>Rib knit trim on hood and hem</li> <li>Thumb loop in cuffs for warmth; front pockets</li> <li>Lower hip length</li></ul><br><br><b>Fabric: </b>6.3-oz 40% organic cotton/35% Tencel/20% all-recycled polyester/5% spandex. Recyclable through the Common Threads Recycling Program<br><br><b>Weight: </b>(323 g 11.2 oz)<br><br>Made in Thailand."
199,"Margot dress - Dig the Margot out of your board bag, throw it on and head out for live salsa;  this super comfy dress is impervious to wrinkles or frump. Soft one-inch straps stay put and merge with a feminine, crossover V-front that supports. A flattering midriff is gathered for comfort; the slight A-line hem drapes to just above the knee. Made from our ultrasoft organic cotton (95%) with a touch of stretch (5% spandex). Recyclable through the Common Threads Recycling Program.<br><br><b>Details:</b><ul> <li>Organic stretch cotton</li> <li>Bra-friendly straps</li> <li>Deep V-front with crossover detail</li> <li>Shirred under-bust band lends support and style</li> <li>A-line hem falls above the knee</li></ul><br><br><b>Fabric: </b>6.2-oz 95% organic cotton/5% spandex. Recyclable through the Common Threads Recycling Program<br><br><b>Weight: </b>(230 g 8 oz)<br><br>Made in Turkey."
