id,description
1,"Active classic boxers - There's a reason why our boxers are a cult favorite - they keep their cool, especially in sticky situations. The quick-drying, lightweight underwear takes up minimal space in a travel pack. An exposed, brushed waistband offers next-to-skin softness, five-panel construction with a traditional boxer back for a classic fit, and a functional fly. Made of 3.7-oz 100% recycled polyester with moisture-wicking performance. Inseam (size M) is 4 1/2"". Recyclable through the Common Threads Recycling Program.<br><br><b>Details:</b><ul> <li>""Silky Capilene 1 fabric is ultralight, breathable and quick-to-dry""</li> <li>""Exposed, brushed elastic waistband for comfort""</li> <li>5-panel construction with traditional boxer back</li> <li>""Inseam (size M) is 4 1/2""""""</li></ul><br><br><b>Fabric: </b>3.7-oz 100% all-recycled polyester with Gladiodor natural odor control for the garment. Recyclable through the Common Threads Recycling Program<br><br><b>Weight: </b>99 g (3.5 oz)<br><br>Made in Mexico."
2,"Active sport boxer briefs - Skinning up Glory requires enough movement without your boxers deciding to poach their own route. The form-fitting Active Sport Boxer Briefs are made from breathable 93% polyester (71% recycled) fabric that's fast-wicking, dries quickly and has 7% spandex for stretch; the seamless waistband and soft leg edges won't roll or bind. The gusseted, flat-sewn 6"" inseam (size M) is offset to prevent inner-thigh chafe. Fly-free with a smooth front panel. Recyclable through the Common Threads Recycling Program.<br><br><b>Details:</b><ul> <li>""Stretch mesh provides support, open-weave mesh for airflow, wicks efficiently, dries fast""</li> <li>Seamless construction</li> <li>""Flat-sewn, gusseted inseam is set forward to prevent inner-thigh chafe""</li> <li>Fly-free support</li> <li>""Inseam (size M) is 6""""""</li></ul><br><br><b>Fabric: </b>""4.6-oz 93% polyester (71% recycled)/7% spandex, with moisture-wicking performance. Recyclable through the Common Threads Recycling Program""<br><br><b>Weight: </b>(60 g 2.1 oz)<br><br>Made in Israel."
3,"Active sport briefs - These superbreathable no-fly briefs are the minimalist's choice for high-octane endeavors. Made from a blend of fast-wicking, quick-drying 93% polyester (71% recycled) and 7% spandex that has both stretch-mesh (for support) and open mesh (for cooling airflow). Soft edging at the leg openings and a seamless waist won't roll or create friction against layers. With a smooth front panel for opacity. Recyclable through the Common Threads Recycling Program.<br><br><b>Details:</b><ul> <li>""Stretch mesh provides support, open-weave mesh for airflow, wicks efficiently and dries fast""</li> <li>Seamless construction</li> <li>Leg openings have half-inch self-binding for comfort</li> <li>Fly-free support</li></ul><br><br><b>Fabric: </b>""4.6-oz 93% polyester (71% recycled)/7% spandex, with moisture-wicking performance. Recyclable through the Common Threads Recycling Program""<br><br><b>Weight: </b>(49 g 1.7 oz)<br><br>Made in Israel."
4,"Alpine guide pants - Skin in, climb ice, switch to rock, traverse a knife-edge ridge and boogie back down - these durable, weather-resistant and breathable soft-shell pants keep stride on every mountain endeavor. The midweight stretch-woven polyester won't restrict your moves, and the brushed interior maintains next-to-skin comfort. A 2-way zippered fly keeps things easy with a harness on, and the gusseted, zippered cuffs have 2-position snaps and tie-down loops. With water-resistant zippered pockets: two front, two thigh, one back hip. Recyclable through the Common Threads Recycling Program.<br><br><b>Details:</b><ul> <li>Durable stretch-woven polyester (47% recycled) with DWR (durable water repellent) finish is water- and wind-resistant and highly breathable</li> <li>Brushed interior for next-to-skin comfort</li> <li>Waistband has belt loops and elastic on back</li> <li>2-way zippered fly</li> <li>""External pockets: two front slash, two glued-on thigh, one back hip - all with highly water-resistant, DWR-finished zippers""</li> <li>""Gusseted, zippered cuff with 2-position adjustable settings and tie-down loops""</li></ul><br><br><b>Fabric: </b>""7.6-oz 90-denier 92% polyester (47% recycled)/8% spandex, with Deluge DWR finish. Recyclable through the Common Threads Recycling Program""<br><br><b>Weight: </b>(597 g 20.7 oz)<br><br>Made in Vietnam."
5,"Alpine wind jkt - On high ridges, steep ice and anything alpine, this jacket serves as a true ""best of all worlds"" staple. It excels as a stand-alone shell for blustery rock climbs, cool-weather trail runs and high-output ski tours. And then, when conditions have you ice and alpine climbing, it functions as a lightly insulated windshirt on the approach, as well as a frictionless midlayer when it's time to bundle up and tie-in. The polyester ripstop shell with a Deluge DWR (durable water repellent) treatment sheds snow and blocks wind, while the smooth, lightly brushed hanging mesh liner wicks moisture, dries fast, and doesn't bind to your baselayers. Superlight stretch-woven underarm panels enhance breathability and allow for unimpaired arm motion, and the two hand pockets close with zippers. A drawcord hem, elastic cuffs, a heat-transfer reflective logo and a regular-coil, center-front zipper with DWR finish round out the features. Updated this season for an improved fit. Recyclable through the Common Threads Recycling Program.<br><br><b>Details:</b><ul> <li>""Lightweight, breathable polyester ripstop fabric with Deluge DWR (durable water repellent) finish; Slightly brushed polyester-mesh liner wicks moisture and dries fast""</li> <li>""Stretch-woven underarm panels provide breathability, stretch for unimpeded range of motion""</li> <li>DWR finish on center-front zipper</li> <li>Elastic cuffs</li> <li>""Pockets: exterior chest, zippered handwarmers""</li> <li>Drawcord hem</li> <li>Reflective heat-transfer logo</li></ul><br><br><b>Fabric: </b>Shell: 1.3-oz 20-denier 100% polyester ripstop. Panels: 4.6-oz 75-denier 90% all-recycled polyester/10% spandex. Shell and panels have Deluge DWR (durable water repellent) finish. Lining: 100% polyester brushed tricot mesh. Recyclable through the Common Threads Recycling Program<br><br><b>Weight: </b>(331 g 11.5 oz)<br><br>Made in China."
6,"Ascensionist jkt - Our most technical soft shell for full-on mountain pursuits strikes the alpinist's balance between protection and minimalism. The dense 2-way-stretch polyester double weave, with stitchless seams, has exceptional water- and wind-resistance, a rapid dry time and superb breathability. Pared-down detailing provides everything you need and nothing more: a 3-way-adjustable, helmet-compatible hood; a reverse-coil center-front zipper with a DWR (durable water repellent) finish; large external handwarmer pockets (with zipper garages) that are placed above the harness-line; an internal security pocket; articulated arms; self-fabic cuff tabs; a drawcord hem. Recyclable through the Common Threads Recycling Program.<br><br><b>Details:</b><ul> <li>""Dense stretchy polyester double-weave fabric is exceptionally water- and wind-resistant and is spandex-free for fast dry times; Stitch-free, lap-glued seams speed dry time, improve water resistance and decrease bulk""</li> <li>""Helmet-compatible, 3-way-adjustable hood;  brushed chamois patches for chin and neck comfort""</li> <li>DWR-(durable water repellent) finished center-front zipper; external pockets: two handwarmers fit skins and have zipper garages and DWR finish on zippers</li> <li>Internal security pocket</li> <li>Articulated arms</li> <li>""Low-profile, laminated, self-fabric cuff tabs""</li> <li>Drawcord hem</li></ul><br><br><b>Fabric: </b>5.3-oz 100% polyester (45% recycled) double weave with 2-way-stretch and Deluge DWR finish. Recyclable through the Common Threads Recycling Program<br><br><b>Weight: </b>(553 g 19.2 oz)<br><br>Made in China."
7,"Atom - A multitasker's cloud nine, the Atom plays the part of courier bag, daypack and carry-on. Its teardrop shape provides the support of a daypack by positioning the load behind your shoulder, and the single-strap design makes getting to the goods simple - just spin it around front. The large zippered main pocket has internal zippered mesh and stretch-woven pockets. A convenient zippered pocket on the shoulder strap is lined to protect valuables. Breathable, moisture-moving 3-D spacer mesh pads the shoulder strap and back panel. Made from 150-denier double-weave all-recycled polyester with a polyurethane coating and DWR (durable water repellent) finish.<br><br><b>Details:</b><ul> <li>Atom spins around from back to chest for easy access</li> <li>Main zippered pocket has internal zippered mesh and stretch-woven organizer pockets</li> <li>Small zippered pocket for essentials</li> <li>""Zippered pocket on shoulder strap is lined to protect cell phone, sunglasses, etc""</li> <li>""Teardrop shape positions weight behind the shoulder, easing stress on neck and back""</li> <li>""3-D spacer-mesh on the shoulder strap and back panel wicks moisture, dries quickly and allows air circulation""</li> <li>Waistbelt secures pack to torso</li></ul><br><br><b>Fabric: </b>7.4-oz 150-denier 100% all-recycled polyester double weave. Lining: 3.3-oz 200-denier 100% polyester. Both with polyurethane coating and a DWR (durable water repellent) finish. Shoulder strap: 100% polyester 3-D spacer mesh<br><br><b>Weight: </b>(311 g 10.8 oz)<br><br>Made in Vietnam."
8,"Print banded betina btm - Our fullest coverage bottoms, the Betina fits highest across the hips with a slightly scooped, lined front. Made from a blend of 82% nylon/18% spandex.<br><br><b>Details:</b><ul> <li>Fullest coverage bottom</li> <li>""Fits highest across hips, full front and back coverage""</li> <li>Regular rise</li> <li>Improved fabric</li></ul><br><br><b>Fabric: </b>5.6-oz 82% nylon/18% spandex<br><br><b>Weight: </b>(49 g 1.7 oz)<br><br>Made in USA."
9,"Baby micro d-luxe cardigan - Micro D-Luxe is a heavenly soft fabric with down-to-earth applications. This cardigan is made from a quick-drying, durable 4.6-oz 100% polyester (87% recycled) microdenier fleece that is lightweight and breathable so it can work as a top or midlayer. A wind flap backs the zip front, while the hood has covered-elastic side trim to bundle babies in deep warmth. With slash-style patch pockets, color-coordinating elbow patches and soft self-fabric cuffs. Recyclable through the Common Threads Recycling Program.<br><br><b>Details:</b><ul> <li>""Soft, microdenier fleece made from 87% recycled polyester is durable and quick-to-dry""</li> <li>Hood stays secure with covered side elastic</li> <li>Inside neck tape for a clean finish</li> <li>Handwarmer patch pockets</li> <li>""Full front zip backed by a wind flap; soft, self-fabric cuffs""</li></ul><br><br><b>Fabric: </b>4.6-oz 100% microdenier polyester (87% recycled) fleece. Recyclable through the Common Threads Recycling Program<br><br><b>Weight: </b>(121 g 4.2 oz)<br><br>Made in Costa Rica."
10,"Baby sun bucket hat - This hat goes on when the sun rises above the horizon, and stays on when raindrops start falling. Its made from an ultra-durable 4-ply, 4.2-oz Supplex nylon fabric with a DWR (durable water repellent) finish, and reverses to either a contrasting solid color or print. A soft tuck-away chin strap with a hook-and-loop fastener holds securely without chafing young jawlines. Packs small; easy care.<br><br><b>Details:</b><ul> <li>""Lightweight Supplex nylon is soft, dries fast and packs small; easy care""</li> <li>Brim shields head and neck</li> <li>Chin strap with hook-and-loop fastener can be tucked away when not in use</li> <li>Reversible style with fun print/solid combinations</li> <li>One colorway has print on both sides</li></ul><br><br><b>Fabric: </b>""4-ply, 4.2-oz Supplex nylon with a DWR (durable water repellent) finish""<br><br><b>Weight: </b>(49 g 1.7 oz)<br><br>Made in China."
11,"Baby sunshade top - Soft, stretchy polyester fabric is fast wicking, quick drying and breathable <br><br><b>Details:</b><ul> <li>Lap shoulders relax the silhouette </li> <li>Extended roll-down cuffs accommodate growth spurts; drop hem waist provides extra coverage</li></ul><br><br><b>Fabric: </b>4.3-oz 100% polyester jersey. Recyclable through the Common Threads Recycling Program<br><br><b>Weight: </b>(0 g 0 oz)<br><br>Made in Vietnam."
12,"Baggies shorts - Even Baggies, our most popular shorts for anything, or nothing, occasionally need an update. This season we've increased the inseam length. Their casual fit, quick-drying water-repellent nylon and elasticized waistband with an internal drawstring remain the same as ever. Other features include a polyester mesh lining, a rear snap pocket and front pockets (with self-draining mesh corners) positioned to reduce drag in the water. Inseam (size M) is 7"". Recyclable through the Common Threads Recycling Program.<br><br><b>Details:</b><ul> <li>Quick-drying nylon with a DWR (durable water repellent) finish</li> <li>Elasticized waistband with internal drawstring; black mesh liner</li> <li>Vertical on-seam side pockets for reduced drag in the water; pocket bags have quick-drain-and-dry mesh corners; snap-closed back pocket</li> <li>""Inseam is 7""""""</li></ul><br><br><b>Fabric: </b>4.2-oz 100% nylon with a DWR finish. Lining: 5.2-oz 100% polyester mesh. Recyclable through the Common Threads Recycling Program<br><br><b>Weight: </b>(233 g 8.1 oz)<br><br>Made in Nicaragua."
13,"Beach bucket - Whenever you're at the junction of water and land, neutralize the sun's unforgiving rays with the wide brim and soft design of our versatile Beach Bucket. It has a durable, semi-rigid foam bill that is black underneath and casts refreshing 360-degree shade. The 6.8-oz 100% stretch-woven nylon fabric looks and feels like soft canvas, but provides water-shedding, fast-drying performance. Details: a moisture-wicking Coolmax headband, soft chin strap and an adjustable rear buckle for a reliable bond. Fabric 6.8-oz 100% stretch-woven nylon with DWR (durable water repellent) finish.<br><br><b>Details:</b><ul> <li>""Tough, easy care, stretch-woven nylon brim has durable, semi-rigid foam that floats""</li> <li>The bill provides 360-degree sun protection</li> <li>Black underbill to reduce glare</li> <li>Soft chin strap; moisture-wicking Coolmax headband; adjustable rear buckle</li></ul><br><br><b>Fabric: </b>6.8-oz 100% stretch-woven nylon with DWR (durable water repellent) finish<br><br><b>Weight: </b>(106 g 3.7 oz)<br><br>Made in China."
14,"Better sweater jkt - June nights camped out in New Mexico's Navajo country are starry and cold. Layer up in the softest fleece we've spun to date. Made from high-performance, sweater-knit polyester fleece, the Better Sweater is warm as wool and technically proficient. The stand-up collar has a zipper garage, and handwarmer pockets keep your fingers cozy. Recyclable through the Common Threads Recycling Program.<br><br><b>Details:</b><ul> <li>""Soft fleece has a sweater-knit face, fleeced interior and heathered overdyed yarns""</li> <li>Stand-up collar and full zip with garage</li> <li>Raglan sleeves</li> <li>Handwarmer pockets</li></ul><br><br><b>Fabric: </b>9.5-oz 100% polyester with sweater-knit exterior and fleece interior. Recyclable through the Common Threads Recycling Program<br><br><b>Weight: </b>(577 g 20 oz)<br><br>Made in Thailand."
15,"Borderless shorts-11 in. - Go forward where others cringe. Our Borderless Shorts are made for prying into the outer reaches of unnamed terrain. They have a light, breathable fabric that blends 95% nylon (60% recycled) with 5% spandex mini ripstop to resist the effects of thrashy chimneys and provide stretch for the body language of going places. The DWR (durable water repellent) finish shrugs off water; built-in 40-UPF sun protection shades your legs in open country. Other features include a gusseted crotch to preserve mobility, two front pockets you can access while wearing a harness and a partially elastic waist to keep your shorts adhered under the load of a hip belt. The rear welted pockets secure with zips. Inseam (size M) is 11"". Recyclable through the Common Threads Recycling Program.<br><br><b>Details:</b><ul> <li>""Supple, soft blend of recycled nylon and spandex for total mobility, a light drape, fast dry time and abrasion resistance""</li> <li>Provides 40-UPF sun protection</li> <li>Partially elasticized waistband supports wide range of motion</li> <li>Generous wide-entry front pockets; left front pocket has a hidden internal zip security pocket; welted zippered back pockets</li> <li>Gusseted crotch for mobility</li> <li>""Inseam is 11""""""</li></ul><br><br><b>Fabric: </b>4-oz 95% nylon (60% recycled)/5% spandex with DWR (durable water repellent) finish. Recyclable through the Common Threads Recycling Program<br><br><b>Weight: </b>(219 g 7.6 oz)<br><br>Made in Vietnam."
16,"Borderless shorts-7 in. - One of summertime's gifts is the chance to freely traverse alpine country. These shorts let you make the most of the season. They're made from a soft, supple weave of 95% nylon (60% recycled) and 5% spandex mini ripstop to stretch with energetic moves and breathe for a cooling airflow. A gusseted crotch allows a wide range of motion and a partially elastic waist keeps your shorts adhered under the load of a hip belt. Two on-the-slant front pockets ensure accessibility under a harness; the rear welted pockets secure with zips. With 40-UPF sun protection; inseam (size M) is 7"". Recyclable through the Common Threads Recycling Program.<br><br><b>Details:</b><ul> <li>""Supple, soft blend of recycled nylon and spandex for total mobility, a light drape, fast dry time and abrasion resistance""</li> <li>Provides 40-UPF sun protection</li> <li>Partially elasticized waistband supports wide range of motion</li> <li>Generous wide-entry front pockets; welted zippered back pockets</li> <li>Gusseted crotch for mobility</li> <li>Inseam is 7'</li></ul><br><br><b>Fabric: </b>4-oz 95% nylon (60% recycled)/5% spandex with DWR (durable water repellent) finish. Recyclable through the Common Threads Recycling Program<br><br><b>Weight: </b>(201 g 7 oz)<br><br>Made in Vietnam."
17,"Bucket hat - Besides its shade-casting prowess, the Bucket provides perfect eye cover after an extra-large fish taco fest. It's made from soft, fast-drying 100% nylon with a water-shedding finish to repel rain and ocean spray. The Bucket Hat features a time-tested design with a linear crown, crushable brim and ventilation holes to keep your noggin from hard-boiling. It also rolls into its own inside pocket.<br><br><b>Details:</b><ul> <li>""Lightweight, fast-drying, easy-care fabric""</li> <li>DWR (durable water repellent) finish sheds rain and ocean spray</li> <li>""Crushable, 360-degree brim provides complete sun protection""</li> <li>Rolls into its inside pocket</li></ul><br><br><b>Fabric: </b>4.2-oz 100% nylon with a DWR (durable water repellent) finish<br><br><b>Weight: </b>(63 g 2.2 oz)<br><br>Made in China."
18,"Cap 1 bottoms - Spring skiing is as transient as the wind. Move fast, move light, and still stay dry with our lightest-weight Capilene performance baselayer. These bottoms wick perspiration, breathe, and dry quickly. Under a shell, they insulate without overheating. The waistband is brushed for softness, inseams are set forward to prevent chafe, and a gusseted crotch improves mobility. With a functional fly. Made from 3.7-oz 100% all-recycled polyester, with Gladiodor natural odor control for the garment and 15-UPF sun protection. Recyclable through the Common Threads Recycling Program.<br><br><b>Details:</b><ul> <li>Silky soft Capilene 1 is the lightest of our technical baselayer fabrics</li> <li>""Fast-drying, highly breathable and sleek, it provides 15-UPF sun protection and can be worn either on its own or under layers in cooler temps""</li> <li>Elastic waistband is brushed for next-to-skin softness</li> <li>""Streamlined, functional fly""</li> <li>Inseams are set forward to prevent chafe</li></ul><br><br><b>Fabric: </b>3.7-oz 100% recycled polyester with Gladiodor natural odor control for the garment and 15-UPF sun protection. Recyclable through the Common Threads Recycling Program<br><br><b>Weight: </b>(158 g 5.5 oz)<br><br>Made in USA."
19,"Cap 1 boxer briefs - On bivy or belay, the form-fitting Capilene 1 Boxer Briefs stay dry and comfortable. Made from 100% recycled polyester, the underwear excels at moisture-wicking and has Gladiodor natural odor control for the garment. Exposed elastic waistband is brushed for softness; the hem is coverstitched for a smooth glide beneath shorts or pants. Fully-functioning fly and supportive front panel keep you covered. 5 1/2"" inseam (size M). Recyclable through the Common Threads Recycling Program.<br><br><b>Details:</b><ul> <li>Moisture-wicking Capilene 1 fabric with Gladiodor for exceptional next-to-skin comfort and natural odor control for the garment</li> <li>Brushed elastic waistband</li> <li>Supportive front panel</li> <li>""Cover-stitched hem for smooth glide under shorts or pants, won't restrict mobility""</li> <li>""Inseam (size M) is 5 1/2""""""</li></ul><br><br><b>Fabric: </b>3.7-oz 100% all-recycled polyester with Gladiodor&#174; natural odor control for the garment. Recyclable through the Common Threads Recycling Program<br><br><b>Weight: </b>(72 g 2.5 oz)<br><br>Made in USA."
20,"Cap 1 graphic t-shirt - This tee is made from our lightest-weight Capilene fabric to achieve a harmonic balance between technical ability and slacker prowess. Designed for dry, cool comfort and sun protection, it's highly breathable and fast-drying and has a silky feel. With a rib-knit collar that's soft against the skin, raglan sleeves that reduce chafing under packs and a tuckable length. Sublimated graphics won't impede breathability. Made from 3.7-oz 100% all-recycled polyester with Gladiodor natural odor control for the garment and 15-UPF sun protection. Recyclable through the Common Threads Recycling Program.<br><br><b>Details:</b><ul> <li>Silky soft Capilene 1 is the lightest of our technical baselayer fabrics</li> <li>""Fast-drying, highly breathable and sleek, it provides 15-UPF sun protection and can be worn either on its own or under layers in cooler temps""</li> <li>Rib-knit collar is soft against the skin</li> <li>Graphic elements sublimated into the fabric won't impede breathability or wicking performance</li> <li>Set-in sleeves</li> <li>Cut long enough to tuck in</li></ul><br><br><b>Fabric: </b>3.7-oz 100% recycled polyester with Gladiodor natural odor control for the garment and 15-UPF sun protection. Recyclable through the Common Threads Recycling Program<br><br><b>Weight: </b>(132 g 4.6 oz)<br><br>Made in USA."
21,"Cap 1 t-shirt - Minimally styled but technically evolved for punishing expanses of hot country, our silky, ultra-breathable Capilene 1 T-Shirt is quick to wick and fast to dry. The rib-knit collar is soft against skin, and the generous hem is long enough to tuck in. Made from 3.7-oz 100% all-recycled polyester, with Gladiodor natural odor control for the garment and 15-UPF sun protection. Recyclable through the Common Threads Recycling Program.<br><br><b>Details:</b><ul> <li>Silky soft Capilene 1 is the lightest of our technical baselayer fabrics</li> <li>""Fast-drying, highly breathable and sleek, it provides 15-UPF sun protection and can be worn either on its own or under layers in cooler temps""</li> <li>Rib-knit collar is soft against the skin</li> <li>Set-in sleeves</li> <li>Cut long enough to tuck in</li></ul><br><br><b>Fabric: </b>3.7-oz 100% recycled polyester with Gladiodor natural odor control for the garment and 15-UPF sun protection. Recyclable through the Common Threads Recycling Program<br><br><b>Weight: </b>130 g (4.6 oz)<br><br>Made in USA."
22,"Cap 2 t-shirt - This one revels in the sweat jamborees of hill climbs, ridge runs and desert singletrack under a resolute sun. Made from the fastest-drying of our performance baselayer fabrics, it has an open knit that invites airflow and provides excellent wicking and exceptional breathability. When worn beneath layers, it's also insulative enough for chilly days. The self-binding neck is pliable and soft; raglan sleeves and flat-ribbed underarm panels merge out of the way of straps to eliminate chafe. Made of 4-oz 100% polyester (54% recycled) with Gladiodor natural odor control for the garment. Recyclable through the Common Threads Recycling Program.<br><br><b>Details:</b><ul> <li>Capilene 2 fabric has an open knit that invites airflow and provides excellent wicking for endurance activities in warm to moderate temperatures</li> <li>""Fastest-drying of our Capilene fabrics, it insulates enough for use on chilly days and can be worn beneath other layers""</li> <li>Self-fabric neckline soft against skin</li> <li>Raglan sleeves and underarm panels merge out of the way of pack straps</li> <li>""Flat-rib panel-piecing under the arms and sides is exceptionally breathable, fast drying and eliminates armpit seam chafing""</li></ul><br><br><b>Fabric: </b>4-oz 100% polyester (54% recycled) with Gladiodor natural odor control for the garment. Recyclable through the Common Threads Recycling Program<br><br><b>Weight: </b>121 g (4.3 oz)<br><br>Made in Mexico."
